{
  "schemaVersion": 1,
  "generationId": "xxh128:2fd5ec67fb43606ccc985aa3d1fcb1d7",
  "manifestDigest": "xxh128:88c774a585a1e9ae521ea8f0306f7a64",
  "provider": "blueprint-static",
  "complete": true,
  "repo": "blueprint-worktree",
  "counts": { "files": 160, "docs": 13, "claims": 82, "codeRefs": 28 },
  "details": {},
  "properties": {},
  "extensions": {}
}
